{
  "$schema": "https://json-schema.org/draft/2020-12/schema",
  "$id": "gre-quant-app/vocab-lesson.schema.json",
  "title": "VocabLesson",
  "type": "object",
  "additionalProperties": false,
  "required": ["id", "title", "words", "story"],
  "properties": {
    "id": { "type": "string", "pattern": "^[a-z0-9]+(-[a-z0-9]+)*$" },
    "title": { "type": "string", "minLength": 1 },
    "story": { "type": "string", "minLength": 1 },
    "words": {
      "type": "array",
      "minItems": 1,
      "items": {
        "type": "object",
        "additionalProperties": false,
        "required": ["id", "word", "partOfSpeech", "definition", "example", "tier"],
        "properties": {
          "id": { "type": "string", "pattern": "^[a-z0-9]+(-[a-z0-9]+)*$" },
          "word": { "type": "string", "minLength": 1 },
          "partOfSpeech": { "type": "string", "minLength": 1 },
          "definition": { "type": "string", "minLength": 1 },
          "example": { "type": "string", "minLength": 1 },
          "tier": { "enum": ["easy", "medium", "hard"] },
          "synonyms": {
            "type": "array",
            "items": { "type": "string", "minLength": 1 },
            "uniqueItems": true
          }
        }
      }
    }
  }
}
